{
  "schema_version": "v0alpha1",
  "target": "managed",
  "captured_at": "2026-08-25",
  "query": "SELECT TABLE_NAME, COLUMN_NAME, SPANNER_TYPE, ORDINAL_POSITION\nFROM INFORMATION_SCHEMA.COLUMNS\nWHERE TABLE_SCHEMA = 'SPANNER_SYS'\nORDER BY TABLE_NAME, ORDINAL_POSITION",
  "content_sha256": "2f1acd9eeff25dcccde68758984e35698f41338d3b4674b7fc7b25d36536fd44",
  "columns": [
    {
      "table_name": "ACTIVE_PARTITIONED_DMLS",
      "column_name": "TEXT",
      "spanner_type": "STRING(MAX)",
      "ordinal_position": 1
    },
    {
      "table_name": "ACTIVE_PARTITIONED_DMLS",
      "column_name": "TEXT_FINGERPRINT",
      "spanner_type": "STRING(MAX)",
      "ordinal_position": 2
    },
    {
      "table_name": "ACTIVE_PARTITIONED_DMLS",
      "column_name": "SESSION_ID",
      "spanner_type": "STRING(MAX)",
      "ordinal_position": 3
    },
    {
      "table_name": "ACTIVE_PARTITIONED_DMLS",
      "column_name": "NUM_PARTITIONS_TOTAL",
      "spanner_type": "INT64",
      "ordinal_position": 4
    },
    {
      "table_name": "ACTIVE_PARTITIONED_DMLS",
      "column_name": "NUM_PARTITIONS_COMPLETE",
      "spanner_type": "INT64",
      "ordinal_position": 5
    },
    {
      "table_name": "ACTIVE_PARTITIONED_DMLS",
      "column_name": "NUM_TRIVIAL_PARTITIONS_COMPLETE",
      "spanner_type": "INT64",
      "ordinal_position": 6
    },
    {
      "table_name": "ACTIVE_PARTITIONED_DMLS",
      "column_name": "PROGRESS",
      "spanner_type": "STRING(MAX)",
      "ordinal_position": 7
    },
    {
      "table_name": "ACTIVE_PARTITIONED_DMLS",
      "column_name": "ROWS_PROCESSED",
      "spanner_type": "INT64",
      "ordinal_position": 8
    },
    {
      "table_name": "ACTIVE_PARTITIONED_DMLS",
      "column_name": "START_TIMESTAMP",
      "spanner_type": "TIMESTAMP",
      "ordinal_position": 9
    },
    {
      "table_name": "ACTIVE_PARTITIONED_DMLS",
      "column_name": "LAST_UPDATE_TIMESTAMP",
      "spanner_type": "TIMESTAMP",
      "ordinal_position": 10
    },
    {
      "table_name": "ACTIVE_QUERIES_SUMMARY",
      "column_name": "ACTIVE_COUNT",
      "spanner_type": "INT64",
      "ordinal_position": 1
    },
    {
      "table_name": "ACTIVE_QUERIES_SUMMARY",
      "column_name": "OLDEST_START_TIME",
      "spanner_type": "TIMESTAMP",
      "ordinal_position": 2
    },
    {
      "table_name": "ACTIVE_QUERIES_SUMMARY",
      "column_name": "COUNT_OLDER_THAN_1S",
      "spanner_type": "INT64",
      "ordinal_position": 3
    },
    {
      "table_name": "ACTIVE_QUERIES_SUMMARY",
      "column_name": "COUNT_OLDER_THAN_10S",
      "spanner_type": "INT64",
      "ordinal_position": 4
    },
    {
      "table_name": "ACTIVE_QUERIES_SUMMARY",
      "column_name": "COUNT_OLDER_THAN_100S",
      "spanner_type": "INT64",
      "ordinal_position": 5
    },
    {
      "table_name": "COLUMN_OPERATIONS_STATS_10MINUTE",
      "column_name": "INTERVAL_END",
      "spanner_type": "TIMESTAMP",
      "ordinal_position": 1
    },
    {
      "table_name": "COLUMN_OPERATIONS_STATS_10MINUTE",
      "column_name": "TABLE_NAME",
      "spanner_type": "STRING(MAX)",
      "ordinal_position": 2
    },
    {
      "table_name": "COLUMN_OPERATIONS_STATS_10MINUTE",
      "column_name": "COLUMN_NAME",
      "spanner_type": "STRING(MAX)",
      "ordinal_position": 3
    },
    {
      "table_name": "COLUMN_OPERATIONS_STATS_10MINUTE",
      "column_name": "QUERY_COUNT",
      "spanner_type": "INT64",
      "ordinal_position": 4
    },
    {
      "table_name": "COLUMN_OPERATIONS_STATS_10MINUTE",
      "column_name": "READ_COUNT",
      "spanner_type": "INT64",
      "ordinal_position": 5
    },
    {
      "table_name": "COLUMN_OPERATIONS_STATS_10MINUTE",
      "column_name": "WRITE_COUNT",
      "spanner_type": "INT64",
      "ordinal_position": 6
    },
    {
      "table_name": "COLUMN_OPERATIONS_STATS_10MINUTE",
      "column_name": "IS_QUERY_CACHE_MEMORY_CAPPED",
      "spanner_type": "BOOL",
      "ordinal_position": 7
    },
    {
      "table_name": "COLUMN_OPERATIONS_STATS_HOUR",
      "column_name": "INTERVAL_END",
      "spanner_type": "TIMESTAMP",
      "ordinal_position": 1
    },
    {
      "table_name": "COLUMN_OPERATIONS_STATS_HOUR",
      "column_name": "TABLE_NAME",
      "spanner_type": "STRING(MAX)",
      "ordinal_position": 2
    },
    {
      "table_name": "COLUMN_OPERATIONS_STATS_HOUR",
      "column_name": "COLUMN_NAME",
      "spanner_type": "STRING(MAX)",
      "ordinal_position": 3
    },
    {
      "table_name": "COLUMN_OPERATIONS_STATS_HOUR",
      "column_name": "QUERY_COUNT",
      "spanner_type": "INT64",
      "ordinal_position": 4
    },
    {
      "table_name": "COLUMN_OPERATIONS_STATS_HOUR",
      "column_name": "READ_COUNT",
      "spanner_type": "INT64",
      "ordinal_position": 5
    },
    {
      "table_name": "COLUMN_OPERATIONS_STATS_HOUR",
      "column_name": "WRITE_COUNT",
      "spanner_type": "INT64",
      "ordinal_position": 6
    },
    {
      "table_name": "COLUMN_OPERATIONS_STATS_HOUR",
      "column_name": "IS_QUERY_CACHE_MEMORY_CAPPED",
      "spanner_type": "BOOL",
      "ordinal_position": 7
    },
    {
      "table_name": "COLUMN_OPERATIONS_STATS_MINUTE",
      "column_name": "INTERVAL_END",
      "spanner_type": "TIMESTAMP",
      "ordinal_position": 1
    },
    {
      "table_name": "COLUMN_OPERATIONS_STATS_MINUTE",
      "column_name": "TABLE_NAME",
      "spanner_type": "STRING(MAX)",
      "ordinal_position": 2
    },
    {
      "table_name": "COLUMN_OPERATIONS_STATS_MINUTE",
      "column_name": "COLUMN_NAME",
      "spanner_type": "STRING(MAX)",
      "ordinal_position": 3
    },
    {
      "table_name": "COLUMN_OPERATIONS_STATS_MINUTE",
      "column_name": "QUERY_COUNT",
      "spanner_type": "INT64",
      "ordinal_position": 4
    },
    {
      "table_name": "COLUMN_OPERATIONS_STATS_MINUTE",
      "column_name": "READ_COUNT",
      "spanner_type": "INT64",
      "ordinal_position": 5
    },
    {
      "table_name": "COLUMN_OPERATIONS_STATS_MINUTE",
      "column_name": "WRITE_COUNT",
      "spanner_type": "INT64",
      "ordinal_position": 6
    },
    {
      "table_name": "COLUMN_OPERATIONS_STATS_MINUTE",
      "column_name": "IS_QUERY_CACHE_MEMORY_CAPPED",
      "spanner_type": "BOOL",
      "ordinal_position": 7
    },
    {
      "table_name": "GRAPH_OPERATION_EXECUTION_STATUS",
      "column_name": "QUERY_ID",
      "spanner_type": "STRING(MAX)",
      "ordinal_position": 1
    },
    {
      "table_name": "GRAPH_OPERATION_EXECUTION_STATUS",
      "column_name": "QUERY_TEXT",
      "spanner_type": "STRING(MAX)",
      "ordinal_position": 2
    },
    {
      "table_name": "GRAPH_OPERATION_EXECUTION_STATUS",
      "column_name": "START_TIMESTAMP",
      "spanner_type": "TIMESTAMP",
      "ordinal_position": 3
    },
    {
      "table_name": "GRAPH_OPERATION_EXECUTION_STATUS",
      "column_name": "LAST_UPDATE_TIMESTAMP",
      "spanner_type": "TIMESTAMP",
      "ordinal_position": 4
    },
    {
      "table_name": "GRAPH_OPERATION_EXECUTION_STATUS",
      "column_name": "PROGRESS",
      "spanner_type": "FLOAT64",
      "ordinal_position": 5
    },
    {
      "table_name": "GRAPH_OPERATION_EXECUTION_STATUS",
      "column_name": "STATUS",
      "spanner_type": "STRING(MAX)",
      "ordinal_position": 6
    },
    {
      "table_name": "GRAPH_OPERATION_EXECUTION_STATUS",
      "column_name": "ERROR_MESSAGE",
      "spanner_type": "STRING(MAX)",
      "ordinal_position": 7
    },
    {
      "table_name": "LOCK_STATS_TOP_10MINUTE",
      "column_name": "INTERVAL_END",
      "spanner_type": "TIMESTAMP",
      "ordinal_position": 1
    },
    {
      "table_name": "LOCK_STATS_TOP_10MINUTE",
      "column_name": "ROW_RANGE_START_KEY",
      "spanner_type": "BYTES(MAX)",
      "ordinal_position": 2
    },
    {
      "table_name": "LOCK_STATS_TOP_10MINUTE",
      "column_name": "LOCK_WAIT_SECONDS",
      "spanner_type": "FLOAT64",
      "ordinal_position": 3
    },
    {
      "table_name": "LOCK_STATS_TOP_10MINUTE",
      "column_name": "SAMPLE_LOCK_REQUESTS",
      "spanner_type": "ARRAY\u003cSTRUCT\u003cCOLUMN STRING(MAX), LOCK_MODE STRING(MAX), TRANSACTION_TAG STRING(MAX)\u003e\u003e",
      "ordinal_position": 4
    },
    {
      "table_name": "LOCK_STATS_TOP_10MINUTE",
      "column_name": "SAMPLE_LOCK_REQUESTS_JSON_STRING",
      "spanner_type": "STRING(MAX)",
      "ordinal_position": 5
    },
    {
      "table_name": "LOCK_STATS_TOP_HOUR",
      "column_name": "INTERVAL_END",
      "spanner_type": "TIMESTAMP",
      "ordinal_position": 1
    },
    {
      "table_name": "LOCK_STATS_TOP_HOUR",
      "column_name": "ROW_RANGE_START_KEY",
      "spanner_type": "BYTES(MAX)",
      "ordinal_position": 2
    },
    {
      "table_name": "LOCK_STATS_TOP_HOUR",
      "column_name": "LOCK_WAIT_SECONDS",
      "spanner_type": "FLOAT64",
      "ordinal_position": 3
    },
    {
      "table_name": "LOCK_STATS_TOP_HOUR",
      "column_name": "SAMPLE_LOCK_REQUESTS",
      "spanner_type": "ARRAY\u003cSTRUCT\u003cCOLUMN STRING(MAX), LOCK_MODE STRING(MAX), TRANSACTION_TAG STRING(MAX)\u003e\u003e",
      "ordinal_position": 4
    },
    {
      "table_name": "LOCK_STATS_TOP_HOUR",
      "column_name": "SAMPLE_LOCK_REQUESTS_JSON_STRING",
      "spanner_type": "STRING(MAX)",
      "ordinal_position": 5
    },
    {
      "table_name": "LOCK_STATS_TOP_MINUTE",
      "column_name": "INTERVAL_END",
      "spanner_type": "TIMESTAMP",
      "ordinal_position": 1
    },
    {
      "table_name": "LOCK_STATS_TOP_MINUTE",
      "column_name": "ROW_RANGE_START_KEY",
      "spanner_type": "BYTES(MAX)",
      "ordinal_position": 2
    },
    {
      "table_name": "LOCK_STATS_TOP_MINUTE",
      "column_name": "LOCK_WAIT_SECONDS",
      "spanner_type": "FLOAT64",
      "ordinal_position": 3
    },
    {
      "table_name": "LOCK_STATS_TOP_MINUTE",
      "column_name": "SAMPLE_LOCK_REQUESTS",